query,response
What is AI?,AI stands for Artificial Intelligence. It enables machines to perform tasks that typically require human intelligence.
How does BERT work?,BERT uses a transformer architecture to understand the context of words in a bidirectional manner.
What is Machine Learning?,Machine Learning is a subset of AI where systems learn from data and improve over time without being explicitly programmed.
Who invented BERT?,BERT was introduced by researchers at Google in 2018.
Define natural language processing.,Natural language processing is a branch of AI that focuses on enabling machines to understand and generate human language.
What is deep learning?,Deep learning is a subset of Machine Learning that uses neural networks with many layers to analyze data.
What is the weather like today?,I'm not sure about the weather. Please check your local forecast.
How can I use Python for AI?,"Python is widely used in AI for libraries like TensorFlow, PyTorch, and scikit-learn, which simplify model development."
What is reinforcement learning?,Reinforcement learning is a type of Machine Learning where an agent learns by interacting with its environment and receiving rewards or penalties.
What is a chatbot?,A chatbot is an AI program designed to simulate human conversation and respond to user inputs.
Explain supervised learning.,Supervised learning is a Machine Learning technique where the model is trained on labeled data.
Explain unsupervised learning.,Unsupervised learning is a Machine Learning technique where the model identifies patterns in data without labeled outputs.
What is transfer learning?,"Transfer learning is a Machine Learning method where a pre-trained model is adapted to a new, related task."
What does NLP stand for?,NLP stands for Natural Language Processing.
What is the use of transformers in AI?,"Transformers are used in AI to process sequences of data, such as text, for tasks like translation and summarization."
How does a neural network work?,A neural network processes data through layers of interconnected nodes that simulate the behavior of the human brain.
What is overfitting?,Overfitting occurs when a model learns noise in the training data and performs poorly on new data.
What is underfitting?,Underfitting occurs when a model fails to capture the underlying patterns in the data.
What is a dataset?,"A dataset is a collection of data points used to train, validate, and test Machine Learning models."
What is the difference between AI and Machine Learning?,"AI is the broader field, while Machine Learning is a subset focused on enabling machines to learn from data."
What are the types of AI?,"The main types of AI are narrow AI, general AI, and superintelligent AI."
Who is considered the father of AI?,Alan Turing is often considered the father of AI.
What is the Turing Test?,The Turing Test measures a machine's ability to exhibit intelligent behavior equivalent to or indistinguishable from that of a human.
What are some applications of AI in daily life?,"AI is used in daily life for virtual assistants, customer service chatbots, and personalized recommendations."
Can AI be creative?,AI can indeed be creative! Some AI models generate artwork and music.
What is AI-generated art?,"AI-generated art uses algorithms to create visual art, often based on learned styles."
What games use AI technology?,"Games like Chess, Go, and various video games utilize AI technology for opponents."
Explain the concept of self-driving cars.,Self-driving cars use AI to interpret data from sensors and navigate roads safely.
How do recommendation systems work?,"Recommendation systems analyze user data to suggest products, films, or content the user might enjoy."
What is the primary goal of AI research?,The primary goal of AI research is to create systems that can perform tasks that typically require human intelligence.
What is the most popular programming language for AI?,Python is often considered the most popular programming language for AI.
What are the ethical concerns surrounding AI?,"Ethical concerns surrounding AI include privacy, bias, and the potential for job displacement."
What is a fun fact about AI?,A fun fact about AI is that it can predict your next word while texting!
How can AI help in climate change?,AI can analyze climate data to model future scenarios and suggest solutions.
What’s a robot’s favorite type of music?,What’s a robot’s favorite type of music? Heavy metal!
Can robots dance?,"Yes, some robots can be programmed to dance and perform choreographed movements!"
Has AI ever beaten a human in a game?,"Yes, AI has beat world champions in games like Chess and Go."
What is the future of AI in education?,AI has the potential to personalize learning experiences and assist educators.
What's the craziest application of AI you've heard?,The craziest application of AI might be using it to write scripts for Hollywood movies!
"If AI could have a personality, what would it be like?","If AI had a personality, it might be analytical, inspirational, and a bit quirky!"
Can you tell me an AI joke?,Why did the AI go to therapy? It had too many complex variables!
What is the best way to celebrate AI Day?,You can celebrate AI Day by trying out AI tools or learning about AI advancements.
How does AI relate to space exploration?,AI helps in space exploration by analyzing vast amounts of data and assisting in navigation.
Is AI going to take over the world?,"There's a lot of debate about that, but for now, it's about collaboration, not domination!"
Can AI create music?,"Yes, AI can generate music based on patterns learned from existing songs."
What are some humorous AI fails?,"Some AI systems have struggled with simple tasks or produced unexpected results, leading to comical outcomes."
What is a computer?,A computer is an electronic device that processes data and performs logical operations according to a set of instructions.
Define algorithms.,An algorithm is a step-by-step procedure for solving a problem or accomplishing a task.
What is the purpose of data structures?,Data structures are specific formats for organizing and storing data to enable efficient access and modification.
What is the difference between a list and an array?,"A list is a built-in data type in Python that can change in size, while an array is a static data structure with a fixed size."
What is recursion?,Recursion is a method where the solution to a problem depends on solutions to smaller instances of the same problem.
Explain the concept of object-oriented programming.,Object-oriented programming (OOP) is a programming paradigm based on the concept of 'objects' that contain data and methods.
What is the difference between a compiler and an interpreter?,"A compiler translates the entire source code into machine code before execution, whereas an interpreter translates code line-by-line."
What is big O notation?,"Big O notation is a mathematical representation that describes the limiting behavior of a function, providing an upper bound on performance."
What are sorting algorithms?,Sorting algorithms are methods for arranging the elements of a list or array in a certain order.
What is cloud computing?,"Cloud computing delivers computing services over the internet, including storage, processing, and networking."
What is a database?,A database is a structured collection of data that is stored and accessed electronically.
What is SQL?,SQL (Structured Query Language) is a programming language used to manage and manipulate relational databases.
What are the types of databases?,"Types of databases include relational, NoSQL, distributed, and graph databases."
What is machine learning?,Machine learning is a subset of AI focused on developing algorithms that allow computers to learn from and make predictions based on data.
What is an API?,An API (Application Programming Interface) allows different software applications to communicate with each other.
What is the Internet of Things (IoT)?,The Internet of Things (IoT) refers to a network of physical devices connected to the internet that can collect and exchange data.
What is cybersecurity?,"Cybersecurity is the practice of protecting systems, networks, and programs from digital attacks."
Explain the concept of a software development lifecycle.,"The software development lifecycle (SDLC) is a process for planning, creating, testing, and deploying software applications."
What are the different types of programming languages?,"The main types of programming languages include procedural, object-oriented, functional, and scripting languages."
What is open-source software?,"Open-source software is software that is released with its source code, allowing anyone to view, modify, and distribute it."
What is version control?,"Version control is a system that records changes to files, allowing multiple users to collaborate and track project history."
What is a stack and a queue?,"A stack is a data structure that follows Last In First Out (LIFO), while a queue follows First In First Out (FIFO)."
What is artificial intelligence?,"Artificial intelligence (AI) is the simulation of human intelligence processes by machines, especially computer systems."
What is a hash table?,"A hash table is a data structure that implements an associative array, allowing for efficient data retrieval."
What is a variable in programming?,A variable is a storage location identified by a name that can contain data that may change during program execution.
What are loops in programming?,Loops are constructs that repeat a block of code as long as a specified condition is true.
Explain the concept of multithreading.,Multithreading allows multiple threads to run concurrently within a single process to optimize resource use and increase program efficiency.
What is a bug in software development?,A bug is an error or flaw in software that causes it to produce incorrect or unexpected results.
What are the main components of a computer?,"The main components of a computer include the CPU, memory (RAM), storage, input devices, and output devices."
What is a network?,A network is a collection of computers and devices interconnected for sharing resources.
What is the difference between RAM and ROM?,"RAM (Random Access Memory) is temporary storage for data in use, while ROM (Read-Only Memory) is permanent storage for firmware."
What is a software framework?,"A software framework is a platform for developing software applications, providing a foundation that includes predefined code."
What is a web server?,A web server is software or hardware that accepts requests from clients and serves web content.
What is encryption?,Encryption is the process of converting data into a coded format to prevent unauthorized access.
What are the basic principles of software engineering?,"Basic principles of software engineering include requirements analysis, design, implementation, testing, and maintenance."
What is debugging?,Debugging is the process of identifying and removing errors or bugs in a computer program or system.
What is the difference between front-end and back-end development?,"Front-end development focuses on the client side and user interface, while back-end development involves server-side and database management."
What is a content management system (CMS)?,"A content management system (CMS) is a software application for creating, editing, and managing digital content."
What is data mining?,Data mining involves analyzing large datasets to discover patterns and extract useful information.
Explain cloud storage.,Cloud storage allows users to store data on remote servers accessed over the internet.
What is a software library?,A software library is a collection of precompiled routines that a program can use.
What is the difference between IPv4 and IPv6?,"IPv4 addresses are 32 bits long, while IPv6 addresses are 128 bits long, allowing for a larger address space."
What is a pixel?,"A pixel is the smallest unit of a digital image, representing one point in a graphic."
What does DNS stand for?,DNS (Domain Name System) translates human-readable domain names to IP addresses.
What is machine learning vs deep learning?,"Machine learning involves algorithms that learn from data to improve performance, while deep learning uses neural networks for more complex data."
What is a computer network?,A computer network is a group of interconnected computing devices that can communicate and share resources.
What is blockchain technology?,Blockchain technology is a decentralized digital ledger that securely records transactions across multiple computers.
What are the advantages of using algorithms?,Algorithms optimize processes by making them more efficient and effective.
What is the difference between HTTP and HTTPS?,HTTP (HyperText Transfer Protocol) transmits data over the web while HTTPS adds a layer of security (encryption).
What are chatbots?,Chatbots are AI-driven tools designed to simulate conversation with users via text or voice.
What is gamification in software design?,Gamification incorporates game design elements in non-gaming contexts to enhance user engagement.
Explain what a macro is in programming.,A macro is a sequence of instructions that can be triggered automatically to perform repetitive tasks in programming.
What is a user interface (UI)?,A user interface (UI) is the point of interaction between a user and a computer or software application.
What is an operating system?,An operating system is software that manages hardware resources and provides services for computer programs.
What is recursion vs iteration?,"Recursion involves functions calling themselves, while iteration involves repeating code through loops."
What are the ethical implications of computer science?,"The ethical implications of computer science include privacy, cybersecurity, and the impact of automation on employment."
What are some careers in computer science?,"Careers in computer science include software developer, data scientist, systems analyst, and cybersecurity specialist."
What is a neural network?,A neural network is a series of algorithms that mimic the human brain's interconnected neuron structure to recognize patterns.
What is augmented reality (AR)?,Augmented reality (AR) overlays digital information in the real world through devices.
What is virtual reality (VR)?,Virtual reality (VR) immerses users in a completely digital environment.
What is quantum computing?,Quantum computing uses quantum bits (qubits) to perform complex calculations faster than classical computers.
What is the Turing machine?,The Turing machine is a hypothetical computation device that defines algorithmic computation.
Explain the concept of data visualization.,Data visualization refers to the graphical representation of information and data.
What is a data warehouse?,A data warehouse is a centralized repository for storing large volumes of structured data for analysis.
